{
  "schema_version": "1.0.0",
  "projection_id": "tab:rev-5336c8b3c6698b26e579fc48",
  "canonical_revision_id": "rev-5336c8b3c6698b26e579fc48",
  "projection_kind": "tab",
  "payload": {
    "schema_version": "1.0.0",
    "canonical_revision_id": "rev-5336c8b3c6698b26e579fc48",
    "instrument_profile_id": "guitar-standard-6",
    "events": [
      {
        "schema_version": "1.0.0",
        "canonical_event_id": "ev-1",
        "start_tick": 0,
        "duration_ticks": 480,
        "midi_note": 45,
        "status": "playable",
        "string_id": "string-6",
        "fret": 5,
        "cents_offset": 0.0
      },
      {
        "schema_version": "1.0.0",
        "canonical_event_id": "ev-2",
        "start_tick": 480,
        "duration_ticks": 480,
        "midi_note": 30,
        "status": "unplayable",
        "string_id": null,
        "fret": null,
        "cents_offset": null
      },
      {
        "schema_version": "1.0.0",
        "canonical_event_id": "ev-3",
        "start_tick": 960,
        "duration_ticks": 480,
        "midi_note": 47,
        "status": "playable",
        "string_id": "string-6",
        "fret": 7,
        "cents_offset": 0.0
      }
    ],
    "unsupported_features": []
  },
  "digest": "sha256:e9399f07d9ea16029780b48333776a9143b97033cb8ef21f1fac4cd72071a299",
  "unsupported_features": []
}
