{
  "schema_version": "1.0.0",
  "projection_id": "notation:rev-439ed305bd1c6a1d54d5f266",
  "canonical_revision_id": "rev-439ed305bd1c6a1d54d5f266",
  "projection_kind": "notation",
  "payload": {
    "schema_version": "1.0.0",
    "canonical_revision_id": "rev-439ed305bd1c6a1d54d5f266",
    "ticks_per_quarter": 480,
    "display_policy": "sharp_preferred_v1",
    "measures": [
      {
        "schema_version": "1.0.0",
        "measure_index": 0,
        "start_tick": 0,
        "end_tick": 1920,
        "meter": {
          "schema_version": "1.0.0",
          "tick": 0,
          "numerator": 4,
          "denominator": 4
        },
        "events": [
          {
            "schema_version": "1.0.0",
            "event_kind": "note",
            "start_tick": 0,
            "duration_ticks": 480,
            "canonical_event_id": "ev-1",
            "midi_note": 64,
            "display_pitch": "E4",
            "display_duration": "quarter",
            "derivation": null
          },
          {
            "schema_version": "1.0.0",
            "event_kind": "note",
            "start_tick": 480,
            "duration_ticks": 480,
            "canonical_event_id": "ev-2",
            "midi_note": 67,
            "display_pitch": "G4",
            "display_duration": "quarter",
            "derivation": null
          },
          {
            "schema_version": "1.0.0",
            "event_kind": "note",
            "start_tick": 960,
            "duration_ticks": 480,
            "canonical_event_id": "ev-3",
            "midi_note": 69,
            "display_pitch": "A4",
            "display_duration": "quarter",
            "derivation": null
          }
        ]
      }
    ],
    "unsupported_features": []
  },
  "digest": "sha256:41d44ce12a40339ed5253319f0aad6de29525a21261793e32a0cbb01e3174703",
  "unsupported_features": []
}
