{
  "schema_version": "1.0.0",
  "projection_id": "notation:rev-16bc98c2d96b53da107f3690",
  "canonical_revision_id": "rev-16bc98c2d96b53da107f3690",
  "projection_kind": "notation",
  "payload": {
    "schema_version": "1.0.0",
    "canonical_revision_id": "rev-16bc98c2d96b53da107f3690",
    "ticks_per_quarter": 480,
    "display_policy": "sharp_preferred_v1",
    "measures": [
      {
        "schema_version": "1.0.0",
        "measure_index": 0,
        "start_tick": 0,
        "end_tick": 1920,
        "meter": {
          "schema_version": "1.0.0",
          "tick": 0,
          "numerator": 4,
          "denominator": 4
        },
        "events": [
          {
            "schema_version": "1.0.0",
            "event_kind": "note",
            "start_tick": 0,
            "duration_ticks": 480,
            "canonical_event_id": "ev-1",
            "midi_note": 76,
            "display_pitch": "E5",
            "display_duration": "quarter",
            "derivation": null
          },
          {
            "schema_version": "1.0.0",
            "event_kind": "note",
            "start_tick": 480,
            "duration_ticks": 480,
            "canonical_event_id": "ev-2",
            "midi_note": 75,
            "display_pitch": "D#5",
            "display_duration": "quarter",
            "derivation": null
          },
          {
            "schema_version": "1.0.0",
            "event_kind": "note",
            "start_tick": 960,
            "duration_ticks": 480,
            "canonical_event_id": "ev-3",
            "midi_note": 73,
            "display_pitch": "C#5",
            "display_duration": "quarter",
            "derivation": null
          },
          {
            "schema_version": "1.0.0",
            "event_kind": "note",
            "start_tick": 1440,
            "duration_ticks": 480,
            "canonical_event_id": "ev-4",
            "midi_note": 71,
            "display_pitch": "B4",
            "display_duration": "quarter",
            "derivation": null
          }
        ]
      },
      {
        "schema_version": "1.0.0",
        "measure_index": 1,
        "start_tick": 1920,
        "end_tick": 3840,
        "meter": {
          "schema_version": "1.0.0",
          "tick": 0,
          "numerator": 4,
          "denominator": 4
        },
        "events": [
          {
            "schema_version": "1.0.0",
            "event_kind": "note",
            "start_tick": 1920,
            "duration_ticks": 480,
            "canonical_event_id": "ev-5",
            "midi_note": 69,
            "display_pitch": "A4",
            "display_duration": "quarter",
            "derivation": null
          },
          {
            "schema_version": "1.0.0",
            "event_kind": "note",
            "start_tick": 2400,
            "duration_ticks": 480,
            "canonical_event_id": "ev-6",
            "midi_note": 67,
            "display_pitch": "G4",
            "display_duration": "quarter",
            "derivation": null
          },
          {
            "schema_version": "1.0.0",
            "event_kind": "note",
            "start_tick": 2880,
            "duration_ticks": 480,
            "canonical_event_id": "ev-7",
            "midi_note": 66,
            "display_pitch": "F#4",
            "display_duration": "quarter",
            "derivation": null
          },
          {
            "schema_version": "1.0.0",
            "event_kind": "note",
            "start_tick": 3360,
            "duration_ticks": 480,
            "canonical_event_id": "ev-8",
            "midi_note": 64,
            "display_pitch": "E4",
            "display_duration": "quarter",
            "derivation": null
          }
        ]
      }
    ],
    "unsupported_features": []
  },
  "digest": "sha256:ee560af3cf7592e01ce6358631a52aaa742a32d08ca0a7adbd8bab2f4fe1c668",
  "unsupported_features": []
}
