{
  "schema_version": "1.0.0",
  "projection_id": "tab:rev-b85e77022251b045cfe38b7d",
  "canonical_revision_id": "rev-b85e77022251b045cfe38b7d",
  "projection_kind": "tab",
  "payload": {
    "schema_version": "1.0.0",
    "canonical_revision_id": "rev-b85e77022251b045cfe38b7d",
    "instrument_profile_id": "guitar-standard-6",
    "events": [
      {
        "schema_version": "1.0.0",
        "canonical_event_id": "ev-1",
        "start_tick": 0,
        "duration_ticks": 480,
        "midi_note": 64,
        "status": "playable",
        "string_id": "string-1",
        "fret": 0,
        "cents_offset": 0.0
      },
      {
        "schema_version": "1.0.0",
        "canonical_event_id": "ev-2",
        "start_tick": 480,
        "duration_ticks": 480,
        "midi_note": 65,
        "status": "playable",
        "string_id": "string-1",
        "fret": 1,
        "cents_offset": 0.0
      },
      {
        "schema_version": "1.0.0",
        "canonical_event_id": "ev-3",
        "start_tick": 960,
        "duration_ticks": 480,
        "midi_note": 66,
        "status": "playable",
        "string_id": "string-1",
        "fret": 2,
        "cents_offset": 0.0
      },
      {
        "schema_version": "1.0.0",
        "canonical_event_id": "ev-4",
        "start_tick": 1440,
        "duration_ticks": 480,
        "midi_note": 67,
        "status": "playable",
        "string_id": "string-1",
        "fret": 3,
        "cents_offset": 0.0
      },
      {
        "schema_version": "1.0.0",
        "canonical_event_id": "ev-5",
        "start_tick": 1920,
        "duration_ticks": 480,
        "midi_note": 68,
        "status": "playable",
        "string_id": "string-1",
        "fret": 4,
        "cents_offset": 0.0
      },
      {
        "schema_version": "1.0.0",
        "canonical_event_id": "ev-6",
        "start_tick": 2400,
        "duration_ticks": 480,
        "midi_note": 69,
        "status": "playable",
        "string_id": "string-1",
        "fret": 5,
        "cents_offset": 0.0
      }
    ],
    "unsupported_features": []
  },
  "digest": "sha256:0c72945fa09e8f50ff713b6bfd8ebccc05442e5bf2547a050f7399dca07ac62c",
  "unsupported_features": []
}
