{
  "schema_version": "1.0.0",
  "projection_id": "tab:rev-e3b0a1db2e0285d09fc33422",
  "canonical_revision_id": "rev-e3b0a1db2e0285d09fc33422",
  "projection_kind": "tab",
  "payload": {
    "schema_version": "1.0.0",
    "canonical_revision_id": "rev-e3b0a1db2e0285d09fc33422",
    "instrument_profile_id": "guitar-standard-6",
    "events": [
      {
        "schema_version": "1.0.0",
        "canonical_event_id": "ev-1",
        "start_tick": 0,
        "duration_ticks": 480,
        "midi_note": 64,
        "status": "playable",
        "string_id": "string-2",
        "fret": 5,
        "cents_offset": 0.0
      },
      {
        "schema_version": "1.0.0",
        "canonical_event_id": "ev-2",
        "start_tick": 480,
        "duration_ticks": 480,
        "midi_note": 67,
        "status": "playable",
        "string_id": "string-5",
        "fret": 22,
        "cents_offset": 0.0
      }
    ],
    "unsupported_features": []
  },
  "digest": "sha256:555f802b1c4017c27744bd94940feb6d41eaeb78d96c7e7bac3ee2b88f9f11d0",
  "unsupported_features": []
}
