{
  "schema_version": "1.0.0",
  "projection_id": "tab:rev-cc28c4e1b3a1e2ae9d130332",
  "canonical_revision_id": "rev-cc28c4e1b3a1e2ae9d130332",
  "projection_kind": "tab",
  "payload": {
    "schema_version": "1.0.0",
    "canonical_revision_id": "rev-cc28c4e1b3a1e2ae9d130332",
    "instrument_profile_id": "guitar-standard-6",
    "events": [
      {
        "schema_version": "1.0.0",
        "canonical_event_id": "ev-1",
        "start_tick": 0,
        "duration_ticks": 480,
        "midi_note": 64,
        "status": "playable",
        "string_id": "string-5",
        "fret": 19,
        "cents_offset": 0.0
      },
      {
        "schema_version": "1.0.0",
        "canonical_event_id": "ev-2",
        "start_tick": 480,
        "duration_ticks": 480,
        "midi_note": 66,
        "status": "playable",
        "string_id": "string-5",
        "fret": 21,
        "cents_offset": 0.0
      },
      {
        "schema_version": "1.0.0",
        "canonical_event_id": "ev-3",
        "start_tick": 960,
        "duration_ticks": 480,
        "midi_note": 67,
        "status": "playable",
        "string_id": "string-5",
        "fret": 22,
        "cents_offset": 0.0
      },
      {
        "schema_version": "1.0.0",
        "canonical_event_id": "ev-4",
        "start_tick": 1440,
        "duration_ticks": 480,
        "midi_note": 69,
        "status": "playable",
        "string_id": "string-4",
        "fret": 19,
        "cents_offset": 0.0
      },
      {
        "schema_version": "1.0.0",
        "canonical_event_id": "ev-5",
        "start_tick": 1920,
        "duration_ticks": 480,
        "midi_note": 71,
        "status": "playable",
        "string_id": "string-4",
        "fret": 21,
        "cents_offset": 0.0
      },
      {
        "schema_version": "1.0.0",
        "canonical_event_id": "ev-6",
        "start_tick": 2400,
        "duration_ticks": 480,
        "midi_note": 73,
        "status": "playable",
        "string_id": "string-3",
        "fret": 18,
        "cents_offset": 0.0
      },
      {
        "schema_version": "1.0.0",
        "canonical_event_id": "ev-7",
        "start_tick": 2880,
        "duration_ticks": 480,
        "midi_note": 75,
        "status": "playable",
        "string_id": "string-3",
        "fret": 20,
        "cents_offset": 0.0
      },
      {
        "schema_version": "1.0.0",
        "canonical_event_id": "ev-8",
        "start_tick": 3360,
        "duration_ticks": 480,
        "midi_note": 76,
        "status": "playable",
        "string_id": "string-3",
        "fret": 21,
        "cents_offset": 0.0
      }
    ],
    "unsupported_features": []
  },
  "digest": "sha256:7c1cf893229aba298f221d27b6f6e88149ea110bb44fdec35807cfefcb573010",
  "unsupported_features": []
}
