{
  "schema_version": "1.0.0",
  "projection_id": "notation:rev-b85e77022251b045cfe38b7d",
  "canonical_revision_id": "rev-b85e77022251b045cfe38b7d",
  "projection_kind": "notation",
  "payload": {
    "schema_version": "1.0.0",
    "canonical_revision_id": "rev-b85e77022251b045cfe38b7d",
    "ticks_per_quarter": 480,
    "display_policy": "sharp_preferred_v1",
    "measures": [
      {
        "schema_version": "1.0.0",
        "measure_index": 0,
        "start_tick": 0,
        "end_tick": 1920,
        "meter": {
          "schema_version": "1.0.0",
          "tick": 0,
          "numerator": 4,
          "denominator": 4
        },
        "events": [
          {
            "schema_version": "1.0.0",
            "event_kind": "note",
            "start_tick": 0,
            "duration_ticks": 480,
            "canonical_event_id": "ev-1",
            "midi_note": 64,
            "display_pitch": "E4",
            "display_duration": "quarter",
            "derivation": null
          },
          {
            "schema_version": "1.0.0",
            "event_kind": "note",
            "start_tick": 480,
            "duration_ticks": 480,
            "canonical_event_id": "ev-2",
            "midi_note": 65,
            "display_pitch": "F4",
            "display_duration": "quarter",
            "derivation": null
          },
          {
            "schema_version": "1.0.0",
            "event_kind": "note",
            "start_tick": 960,
            "duration_ticks": 480,
            "canonical_event_id": "ev-3",
            "midi_note": 66,
            "display_pitch": "F#4",
            "display_duration": "quarter",
            "derivation": null
          },
          {
            "schema_version": "1.0.0",
            "event_kind": "note",
            "start_tick": 1440,
            "duration_ticks": 480,
            "canonical_event_id": "ev-4",
            "midi_note": 67,
            "display_pitch": "G4",
            "display_duration": "quarter",
            "derivation": null
          }
        ]
      },
      {
        "schema_version": "1.0.0",
        "measure_index": 1,
        "start_tick": 1920,
        "end_tick": 3840,
        "meter": {
          "schema_version": "1.0.0",
          "tick": 0,
          "numerator": 4,
          "denominator": 4
        },
        "events": [
          {
            "schema_version": "1.0.0",
            "event_kind": "note",
            "start_tick": 1920,
            "duration_ticks": 480,
            "canonical_event_id": "ev-5",
            "midi_note": 68,
            "display_pitch": "G#4",
            "display_duration": "quarter",
            "derivation": null
          },
          {
            "schema_version": "1.0.0",
            "event_kind": "note",
            "start_tick": 2400,
            "duration_ticks": 480,
            "canonical_event_id": "ev-6",
            "midi_note": 69,
            "display_pitch": "A4",
            "display_duration": "quarter",
            "derivation": null
          }
        ]
      }
    ],
    "unsupported_features": []
  },
  "digest": "sha256:ad3640d694eb2e9d899344b012f48c74af4ff7eb5645ed81baaf127a98afdf54",
  "unsupported_features": []
}
