{
  "schema_version": "1.0.0",
  "projection_id": "notation:rev-e3b0a1db2e0285d09fc33422",
  "canonical_revision_id": "rev-e3b0a1db2e0285d09fc33422",
  "projection_kind": "notation",
  "payload": {
    "schema_version": "1.0.0",
    "canonical_revision_id": "rev-e3b0a1db2e0285d09fc33422",
    "ticks_per_quarter": 480,
    "display_policy": "sharp_preferred_v1",
    "measures": [
      {
        "schema_version": "1.0.0",
        "measure_index": 0,
        "start_tick": 0,
        "end_tick": 1920,
        "meter": {
          "schema_version": "1.0.0",
          "tick": 0,
          "numerator": 4,
          "denominator": 4
        },
        "events": [
          {
            "schema_version": "1.0.0",
            "event_kind": "note",
            "start_tick": 0,
            "duration_ticks": 480,
            "canonical_event_id": "ev-1",
            "midi_note": 64,
            "display_pitch": "E4",
            "display_duration": "quarter",
            "derivation": null
          },
          {
            "schema_version": "1.0.0",
            "event_kind": "note",
            "start_tick": 480,
            "duration_ticks": 480,
            "canonical_event_id": "ev-2",
            "midi_note": 67,
            "display_pitch": "G4",
            "display_duration": "quarter",
            "derivation": null
          }
        ]
      }
    ],
    "unsupported_features": []
  },
  "digest": "sha256:aeb7af1ab7e1a83807a6c54d8015afa93aebe98480554b5b32fbb9543afdf38e",
  "unsupported_features": []
}
