{
  "schema_version": "1.0.0",
  "projection_id": "notation:rev-9ac1cd971dfe054ebf07ecea",
  "canonical_revision_id": "rev-9ac1cd971dfe054ebf07ecea",
  "projection_kind": "notation",
  "payload": {
    "schema_version": "1.0.0",
    "canonical_revision_id": "rev-9ac1cd971dfe054ebf07ecea",
    "ticks_per_quarter": 480,
    "display_policy": "sharp_preferred_v1",
    "measures": [
      {
        "schema_version": "1.0.0",
        "measure_index": 0,
        "start_tick": 0,
        "end_tick": 1920,
        "meter": {
          "schema_version": "1.0.0",
          "tick": 0,
          "numerator": 4,
          "denominator": 4
        },
        "events": [
          {
            "schema_version": "1.0.0",
            "event_kind": "note",
            "start_tick": 0,
            "duration_ticks": 480,
            "canonical_event_id": "ev-1",
            "midi_note": 40,
            "display_pitch": "E2",
            "display_duration": "quarter",
            "derivation": null
          },
          {
            "schema_version": "1.0.0",
            "event_kind": "note",
            "start_tick": 480,
            "duration_ticks": 480,
            "canonical_event_id": "ev-2",
            "midi_note": 55,
            "display_pitch": "G3",
            "display_duration": "quarter",
            "derivation": null
          },
          {
            "schema_version": "1.0.0",
            "event_kind": "note",
            "start_tick": 960,
            "duration_ticks": 480,
            "canonical_event_id": "ev-3",
            "midi_note": 45,
            "display_pitch": "A2",
            "display_duration": "quarter",
            "derivation": null
          },
          {
            "schema_version": "1.0.0",
            "event_kind": "note",
            "start_tick": 1440,
            "duration_ticks": 480,
            "canonical_event_id": "ev-4",
            "midi_note": 59,
            "display_pitch": "B3",
            "display_duration": "quarter",
            "derivation": null
          }
        ]
      },
      {
        "schema_version": "1.0.0",
        "measure_index": 1,
        "start_tick": 1920,
        "end_tick": 3840,
        "meter": {
          "schema_version": "1.0.0",
          "tick": 0,
          "numerator": 4,
          "denominator": 4
        },
        "events": [
          {
            "schema_version": "1.0.0",
            "event_kind": "note",
            "start_tick": 1920,
            "duration_ticks": 480,
            "canonical_event_id": "ev-5",
            "midi_note": 50,
            "display_pitch": "D3",
            "display_duration": "quarter",
            "derivation": null
          },
          {
            "schema_version": "1.0.0",
            "event_kind": "note",
            "start_tick": 2400,
            "duration_ticks": 480,
            "canonical_event_id": "ev-6",
            "midi_note": 64,
            "display_pitch": "E4",
            "display_duration": "quarter",
            "derivation": null
          }
        ]
      }
    ],
    "unsupported_features": []
  },
  "digest": "sha256:b6e4dd67fc5b3f546e92fa6d28b4ded74650c66747a6809fb3c7a225a4e2602e",
  "unsupported_features": []
}
