{
  "schema_version": "1.0.0",
  "projection_id": "tab:rev-40b97b84994cc778ab7237ae",
  "canonical_revision_id": "rev-40b97b84994cc778ab7237ae",
  "projection_kind": "tab",
  "payload": {
    "schema_version": "1.0.0",
    "canonical_revision_id": "rev-40b97b84994cc778ab7237ae",
    "instrument_profile_id": "guitar-standard-6",
    "events": [
      {
        "schema_version": "1.0.0",
        "canonical_event_id": "ev-1",
        "start_tick": 0,
        "duration_ticks": 480,
        "midi_note": 40,
        "status": "playable",
        "string_id": "string-6",
        "fret": 0,
        "cents_offset": 0.0
      },
      {
        "schema_version": "1.0.0",
        "canonical_event_id": "ev-2",
        "start_tick": 480,
        "duration_ticks": 480,
        "midi_note": 42,
        "status": "playable",
        "string_id": "string-6",
        "fret": 2,
        "cents_offset": 0.0
      },
      {
        "schema_version": "1.0.0",
        "canonical_event_id": "ev-3",
        "start_tick": 960,
        "duration_ticks": 480,
        "midi_note": 43,
        "status": "playable",
        "string_id": "string-6",
        "fret": 3,
        "cents_offset": 0.0
      },
      {
        "schema_version": "1.0.0",
        "canonical_event_id": "ev-4",
        "start_tick": 1440,
        "duration_ticks": 480,
        "midi_note": 45,
        "status": "playable",
        "string_id": "string-6",
        "fret": 5,
        "cents_offset": 0.0
      },
      {
        "schema_version": "1.0.0",
        "canonical_event_id": "ev-5",
        "start_tick": 1920,
        "duration_ticks": 480,
        "midi_note": 64,
        "status": "playable",
        "string_id": "string-5",
        "fret": 19,
        "cents_offset": 0.0
      },
      {
        "schema_version": "1.0.0",
        "canonical_event_id": "ev-6",
        "start_tick": 2400,
        "duration_ticks": 480,
        "midi_note": 66,
        "status": "playable",
        "string_id": "string-5",
        "fret": 21,
        "cents_offset": 0.0
      },
      {
        "schema_version": "1.0.0",
        "canonical_event_id": "ev-7",
        "start_tick": 2880,
        "duration_ticks": 480,
        "midi_note": 67,
        "status": "playable",
        "string_id": "string-5",
        "fret": 22,
        "cents_offset": 0.0
      },
      {
        "schema_version": "1.0.0",
        "canonical_event_id": "ev-8",
        "start_tick": 3360,
        "duration_ticks": 480,
        "midi_note": 69,
        "status": "playable",
        "string_id": "string-4",
        "fret": 19,
        "cents_offset": 0.0
      }
    ],
    "unsupported_features": []
  },
  "digest": "sha256:657cdfc9bdaa48762acfe4e8475f751852198de3033c343da173ebd848b2a3be",
  "unsupported_features": []
}
